{
  "schemaVersion": 1,
  "generatedAt": "2026-07-17T00:55:57.721601Z",
  "project": {
    "repository": "MerverliPy/hermes-webui",
    "siteSlug": "hermes-agent-web-ui",
    "siteProjectId": "appgprj_6a57ca3238c081919fcc5634802b2800",
    "trackedVersion": 24,
    "siteRevisionKey": "hermes-site-version-24-27b62e0a21a1",
    "adapterPhase": "host-synchronized",
    "lastSynchronizedAt": "2026-07-16T21:23:19.524Z",
    "visualDirection": "graphite-and-cyan",
    "requirements": [
      "Preserve responsive desktop and mobile layouts.",
      "Preserve the six-destination mobile bottom navigation."
    ]
  },
  "statusRows": [
    {
      "id": "repository",
      "label": "Repository",
      "value": "MerverliPy/hermes-webui",
      "status": "recorded",
      "evidence": []
    },
    {
      "id": "sourceRevision",
      "label": "Source revision",
      "value": "0929062026f1d857a7e50b6356820d09c4bc67a2",
      "status": "verified",
      "evidence": [
        {
          "source": "git",
          "detail": "git rev-parse HEAD"
        }
      ]
    },
    {
      "id": "branch",
      "label": "Branch",
      "value": "fix/project-control-version-24",
      "status": "verified",
      "evidence": [
        {
          "source": "git",
          "detail": "git branch --show-current"
        }
      ]
    },
    {
      "id": "projectVersion",
      "label": "Tracked project version",
      "value": "Version 24",
      "status": "verified",
      "evidence": [
        {
          "source": "ChatGPT Sites host receipt",
          "detail": "revision 24; revision key hermes-site-version-24-27b62e0a21a1"
        }
      ]
    },
    {
      "id": "siteProject",
      "label": "Site project",
      "value": "appgprj_6a57ca3238c081919fcc5634802b2800",
      "status": "verified",
      "evidence": [
        {
          "source": "ChatGPT Sites host receipt",
          "detail": "Hermes Agent Web UI; synchronized 2026-07-16T21:23:19.524Z"
        }
      ]
    },
    {
      "id": "siteCheckpoint",
      "label": "Authoritative Site checkpoint",
      "value": null,
      "status": "unresolved",
      "evidence": []
    },
    {
      "id": "siteDeployment",
      "label": "Authoritative Site deployment",
      "value": null,
      "status": "unresolved",
      "evidence": []
    },
    {
      "id": "controlStudio",
      "label": "Website Control Studio host adapter",
      "value": "host-synchronized; no direct Sites API or credentials; production publishing unavailable",
      "status": "verified",
      "evidence": [
        {
          "source": "host adapter",
          "detail": "site identity and revision receipt synchronized at 2026-07-16T21:23:19.524Z"
        }
      ]
    },
    {
      "id": "screenshot",
      "label": "Screenshot comparison",
      "value": "Version 23 production screenshot failed; current reconciliation unresolved",
      "status": "unresolved",
      "evidence": [
        {
          "source": "Version 24 handoff",
          "detail": "failed Version 23 screenshot preserved; exact failure details unresolved"
        }
      ]
    },
    {
      "id": "cancellationRecovery",
      "label": "Cancellation recovery",
      "value": "Hermes live response could not complete; the current conversation is preserved",
      "status": "failed",
      "evidence": []
    }
  ],
  "simulationBoundary": {
    "protected": true,
    "status": "simulated",
    "statement": "Do not claim that agents, tasks, missions, models, telemetry, approvals, settings, artifacts, tools, or persistence are connected to a real Hermes backend unless independently verified."
  }
}
